{
"product_info": {
"product_info_addr": "product_info_addr",
"product_id": "CB04"
},
"page_num": 8,
"page_data": [
{
"valid": 1,
"page_index": 0,
"lightness": 100,
"speed_ms": 100,
"color": {
"default": false,
"back_rgb": "#000000",
"rgb": "#000000"
},
"word_page": {
"valid": 0,
"word_len": 0,
"unicode": []
},
"frames": {
"valid": 1,
"frame_num": 0,
"frame_data": [
{
"frame_index": 0,
"frame_RGB": [
"#0000"
]
}
]
},
"keyframes": {
"valid": 1,
"frame_num": 0,
"frame_data": [
{
"frame_index": 0,
"frame_RGB": [
"#0000"
]
}
]
}
},
{
"valid": 1,
"page_index": 1,
"lightness": 100,
"speed_ms": 100,
"color": {
"default": false,
"back_rgb": "#000000",
"rgb": "#000000"
},
"word_page": {
"valid": 0,
"word_len": 0,
"unicode": []
},
"frames": {
"valid": 1,
"frame_num": 0,
"frame_data": [
{
"frame_index": 0,
"frame_RGB": [
"#0000"
]
}
]
},
"keyframes": {
"valid": 1,
"frame_num": 0,
"frame_data": [
{
"frame_index": 0,
"frame_RGB": [
"#0000"
]
}
]
}
},
{
"valid": 1,
"page_index": 2,
"lightness": 100,
"speed_ms": 100,
"color": {
"default": false,
"back_rgb": "#000000",
"rgb": "#000000"
},
"word_page": {
"valid": 0,
"word_len": 0,
"unicode": []
},
"frames": {
"valid": 1,
"frame_num": 0,
"frame_data": [
{
"frame_index": 0,
"frame_RGB": [
"#0000"
]
}
]
},
"keyframes": {
"valid": 1,
"frame_num": 0,
"frame_data": [
{
"frame_index": 0,
"frame_RGB": [
"#0000"
]
}
]
}
},
{
"valid": 0,
"page_index": 3,
"lightness": 100,
"speed_ms": 100,
"color": {
"default": false,
"back_rgb": "#000000",
"rgb": "#000000"
},
"word_page": {
"valid": 0,
"word_len": 0,
"unicode": []
},
"frames": {
"valid": 1,
"frame_num": 0,
"frame_data": [
{
"frame_index": 0,
"frame_RGB": [
"#0000"
]
}
]
},
"keyframes": {
"valid": 1,
"frame_num": 0,
"frame_data": [
{
"frame_index": 0,
"frame_RGB": [
"#0000"
]
}
]
}
},
{
"valid": 0,
"page_index": 4,
"lightness": 100,
"speed_ms": 100,
"color": {
"default": false,
"back_rgb": "#000000",
"rgb": "#000000"
},
"word_page": {
"valid": 0,
"word_len": 0,
"unicode": []
},
"frames": {
"valid": 1,
"frame_num": 0,
"frame_data": [
{
"frame_index": 0,
"frame_RGB": [
"#0000"
]
}
]
},
"keyframes": {
"valid": 1,
"frame_num": 0,
"frame_data": [
{
"frame_index": 0,
"frame_RGB": [
"#0000"
]
}
]
}
},
{
"valid": 0,
"page_index": 5,
"lightness": 100,
"speed_ms": 100,
"color": {
"default": false,
"back_rgb": "#000000",
"rgb": "#000000"
},
"word_page": {
"valid": 0,
"word_len": 0,
"unicode": []
},
"frames": {
"valid": 1,
"frame_num": 0,
"frame_data": [
{
"frame_index": 0,
"frame_RGB": [
"#0000"
]
}
]
},
"keyframes": {
"valid": 1,
"frame_num": 0,
"frame_data": [
{
"frame_index": 0,
"frame_RGB": [
"#0000"
]
}
]
}
},
{
"valid": 0,
"page_index": 6,
"lightness": 100,
"speed_ms": 100,
"color": {
"default": false,
"back_rgb": "#000000",
"rgb": "#000000"
},
"word_page": {
"valid": 0,
"word_len": 0,
"unicode": []
},
"frames": {
"valid": 1,
"frame_num": 0,
"frame_data": [
{
"frame_index": 0,
"frame_RGB": [
"#0000"
]
}
]
},
"keyframes": {
"valid": 1,
"frame_num": 0,
"frame_data": [
{
"frame_index": 0,
"frame_RGB": [
"#0000"
]
}
]
}
},
{
"valid": 0,
"page_index": 7,
"lightness": 100,
"speed_ms": 100,
"color": {
"default": false,
"back_rgb": "#000000",
"rgb": "#000000"
},
"word_page": {
"valid": 0,
"word_len": 0,
"unicode": []
},
"frames": {
"valid": 1,
"frame_num": 0,
"frame_data": [
{
"frame_index": 0,
"frame_RGB": [
"#0000"
]
}
]
},
"keyframes": {
"valid": 1,
"frame_num": 0,
"frame_data": [
{
"frame_index": 0,
"frame_RGB": [
"#0000"
]
}
]
}
}
],
"key_layer": {
"valid": 1,
"layer_num": 7,
"layer_data": [
{
"layer": [
"#00000000",
"#00000000",
"#00000000",
"#00000000",
"#00000000",
"#00000000",
"#00000000",
"#00000000",
"#00000000",
"#00000000",
"#00000000",
"#00000000",
"#00000000",
"#00000000",
"#00000000",
"#00000000",
"#00000000",
"#00000000",
"#00000000",
"#00000000",
"#00000000",
"#00000000",
"#00000000",
"#00000000",
"#00000000",
"#00000000",
"#00000000",
"#00000000",
"#00000000",
"#00000000",
"#00000000",
"#00000000",
"#00000000",
"#00000000",
"#00000000",
"#00000000",
"#00000000",
"#00000000",
"#00000000",
"#00000000",
"#00000000",
"#00000000",
"#00000000",
"#00000000",
"#00000000",
"#00000000",
"#00000000",
"#00000000",
"#00000000",
"#00000000",
"#00000000",
"#00000000",
"#00000000",
"#00000000",
"#00000000",
"#00000000",
"#00000000",
"#00000000",
"#00000000",
"#00000000",
"#00000000",
"#00000000",
"#00000000",
"#00000000",
"#00000000",
"#00000000",
"#00000000",
"#00000000",
"#00000000",
"#00000000",
"#00000000",
"#00000000",
"#00000000",
"#00000000",
"#00000000",
"#00000000",
"#00000000",
"#00000000",
"#00000000",
"#00000000",
"#00000000",
"#00000000",
"#00000000",
"#00000000",
"#00000000",
"#00000000",
"#00000000",
"#00000000",
"#00000000",
"#00000000",
"#00000000",
"#00000000",
"#00000000",
"#00000000",
"#00000000",
"#00000000",
"#00000000",
"#00000000",
"#00000000",
"#00000000",
"#00000000",
"#00000000",
"#00000000",
"#00000000",
"#00000000",
"#00000000",
"#00000000",
"#00000000",
"#00000000",
"#00000000",
"#00000000",
"#00000000",
"#00000000",
"#00000000",
"#00000000",
"#00000000",
"#00000000",
"#00000000",
"#00000000",
"#00000000",
"#00000000",
"#00000000",
"#00000000",
"#00000000",
"#00000000",
"#00000000",
"#00000000",
"#00000000",
"#00000000",
"#00000000",
"#00000000",
"#00000000",
"#00000000",
"#00000000",
"#00000000",
"#00000000",
"#00000000",
"#00000000",
"#00000000",
"#00000000",
"#00000000",
"#00000000",
"#00000000",
"#00000000",
"#00000000",
"#00000000",
"#00000000",
"#00000000",
"#00000000",
"#00000000",
"#00000000",
"#00000000",
"#00000000",
"#00000000",
"#00000000",
"#00000000",
"#00000000",
"#00000000",
"#00000000",
"#00000000",
"#00000000",
"#00000000",
"#00000000",
"#00000000",
"#00000000",
"#00000000",
"#00000000",
"#00000000",
"#00000000",
"#00000000",
"#00000000",
"#00000000",
"#00000000",
"#00000000",
"#00000000",
"#00000000",
"#00000000",
"#00000000",
"#00000000",
"#00000000",
"#00000000",
"#00000000",
"#00000000",
"#00000000",
"#00000000",
"#00000000",
"#00000000",
"#00000000",
"#00000000",
"#00000000",
"#00000000",
"#00000000",
"#00000000",
"#00000000",
"#00000000",
"#00000000",
"#00000000",
"#00000000",
"#00000000",
"#00000000"
]
},
{
"layer": [
"#00000000",
"#00000000",
"#00000000",
"#00000000",
"#00000000",
"#00000000",
"#00000000",
"#00000000",
"#00000000",
"#00000000",
"#00000000",
"#00000000",
"#00000000",
"#00000000",
"#00000000",
"#00000000",
"#00000000",
"#00000000",
"#00000000",
"#00000000",
"#00000000",
"#00000000",
"#00000000",
"#00000000",
"#00000000",
"#00000000",
"#00000000",
"#00000000",
"#00000000",
"#00000000",
"#00000000",
"#00000000",
"#00000000",
"#00000000",
"#00000000",
"#00000000",
"#00000000",
"#00000000",
"#00000000",
"#00000000",
"#00000000",
"#00000000",
"#00000000",
"#00000000",
"#00000000",
"#00000000",
"#00000000",
"#00000000",
"#00000000",
"#00000000",
"#00000000",
"#00000000",
"#00000000",
"#00000000",
"#00000000",
"#00000000",
"#00000000",
"#00000000",
"#00000000",
"#00000000",
"#00000000",
"#00000000",
"#00000000",
"#00000000",
"#00000000",
"#00000000",
"#00000000",
"#00000000",
"#00000000",
"#00000000",
"#00000000",
"#00000000",
"#00000000",
"#00000000",
"#00000000",
"#00000000",
"#00000000",
"#00000000",
"#00000000",
"#00000000",
"#00000000",
"#00000000",
"#00000000",
"#00000000",
"#00000000",
"#00000000",
"#00000000",
"#00000000",
"#00000000",
"#00000000",
"#00000000",
"#00000000",
"#00000000",
"#00000000",
"#00000000",
"#00000000",
"#00000000",
"#00000000",
"#00000000",
"#00000000",
"#00000000",
"#00000000",
"#00000000",
"#00000000",
"#00000000",
"#00000000",
"#00000000",
"#00000000",
"#00000000",
"#00000000",
"#00000000",
"#00000000",
"#00000000",
"#00000000",
"#00000000",
"#00000000",
"#00000000",
"#00000000",
"#00000000",
"#00000000",
"#00000000",
"#00000000",
"#00000000",
"#00000000",
"#00000000",
"#00000000",
"#00000000",
"#00000000",
"#00000000",
"#00000000",
"#00000000",
"#00000000",
"#00000000",
"#00000000",
"#00000000",
"#00000000",
"#00000000",
"#00000000",
"#00000000",
"#00000000",
"#00000000",
"#00000000",
"#00000000",
"#00000000",
"#00000000",
"#00000000",
"#00000000",
"#00000000",
"#00000000",
"#00000000",
"#00000000",
"#00000000",
"#00000000",
"#00000000",
"#00000000",
"#00000000",
"#00000000",
"#00000000",
"#00000000",
"#00000000",
"#00000000",
"#00000000",
"#00000000",
"#00000000",
"#00000000",
"#00000000",
"#00000000",
"#00000000",
"#00000000",
"#00000000",
"#00000000",
"#00000000",
"#00000000",
"#00000000",
"#00000000",
"#00000000",
"#00000000",
"#00000000",
"#00000000",
"#00000000",
"#00000000",
"#00000000",
"#00000000",
"#00000000",
"#00000000",
"#00000000",
"#00000000",
"#00000000",
"#00000000",
"#00000000",
"#00000000",
"#00000000",
"#00000000",
"#00000000",
"#00000000",
"#00000000",
"#00000000",
"#00000000",
"#00000000",
"#00000000"
]
},
{
"layer": [
"#00000000",
"#00000000",
"#00000000",
"#00000000",
"#00000000",
"#00000000",
"#00000000",
"#00000000",
"#00000000",
"#00000000",
"#00000000",
"#00000000",
"#00000000",
"#00000000",
"#00000000",
"#00000000",
"#00000000",
"#00000000",
"#00000000",
"#00000000",
"#00000000",
"#00000000",
"#00000000",
"#00000000",
"#00000000",
"#00000000",
"#00000000",
"#00000000",
"#00000000",
"#00000000",
"#00000000",
"#00000000",
"#00000000",
"#00000000",
"#00000000",
"#00000000",
"#00000000",
"#00000000",
"#00000000",
"#00000000",
"#00000000",
"#00000000",
"#00000000",
"#00000000",
"#00000000",
"#00000000",
"#00000000",
"#00000000",
"#00000000",
"#00000000",
"#00000000",
"#00000000",
"#00000000",
"#00000000",
"#00000000",
"#00000000",
"#00000000",
"#00000000",
"#00000000",
"#00000000",
"#00000000",
"#00000000",
"#00000000",
"#00000000",
"#00000000",
"#00000000",
"#00000000",
"#00000000",
"#00000000",
"#00000000",
"#00000000",
"#00000000",
"#00000000",
"#00000000",
"#00000000",
"#00000000",
"#00000000",
"#00000000",
"#00000000",
"#00000000",
"#00000000",
"#00000000",
"#00000000",
"#00000000",
"#00000000",
"#00000000",
"#00000000",
"#00000000",
"#00000000",
"#00000000",
"#00000000",
"#00000000",
"#00000000",
"#00000000",